{
  "$schema": "https://json-schema.org/draft/2020-12/schema",
  "$id": "https://hermes.local/dfm/measurement.schema.json",
  "title": "Hermes DFM Measurement Artifact",
  "type": "object",
  "additionalProperties": false,
  "required": ["schema_version", "run_id", "input_sha256", "process", "scope_id", "producer_contract", "measurements"],
  "properties": {
    "schema_version": {"const": 1},
    "contract_version": {"enum": ["dfm.geometry.artifact/measurements/v1"]},
    "run_id": {"type": "string", "minLength": 1},
    "input_sha256": {"type": "string", "pattern": "^[0-9a-f]{64}$"},
    "process": {"type": "string", "minLength": 1},
    "scope_id": {"type": "string", "minLength": 1},
    "scope_version": {"type": "string", "minLength": 1},
    "producer_contract": {"const": "measurement_only"},
    "measurements": {"type": "array", "items": {"$ref": "#/$defs/measurement"}}
  },
  "$defs": {
    "geometryRef": {
      "type": "object",
      "additionalProperties": false,
      "required": ["kind", "index", "input_sha256"],
      "properties": {
        "kind": {"enum": ["face", "edge", "solid", "vertex"]},
        "index": {"type": "integer", "minimum": 0},
        "input_sha256": {"type": "string", "pattern": "^[0-9a-f]{64}$"}
      }
    },
    "measurement": {
      "type": "object",
      "additionalProperties": false,
      "required": ["measurement_id", "operation_id", "calculator_id", "metric_id", "quantity_id", "value", "unit", "status", "geometry_refs", "region_refs", "field_refs", "method", "algorithm_version", "input_sha256", "quality", "diagnostics"],
      "properties": {
        "measurement_id": {"type": "string", "minLength": 1},
        "operation_id": {"type": "string", "minLength": 1},
        "calculator_id": {"type": "string", "minLength": 1},
        "metric_id": {"type": "string", "minLength": 1},
        "quantity_id": {"type": "string", "minLength": 1},
        "value": {},
        "unit": {"type": ["string", "null"]},
        "status": {"type": "string", "minLength": 1},
        "geometry_refs": {"type": "array", "items": {"$ref": "#/$defs/geometryRef"}},
        "region_refs": {"type": "array", "uniqueItems": true, "items": {"type": "string"}},
        "field_refs": {"type": "array", "uniqueItems": true, "items": {"type": "string", "minLength": 1}},
        "method": {"type": "string", "minLength": 1},
        "algorithm_version": {"type": "string", "minLength": 1},
        "input_sha256": {"type": "string", "pattern": "^[0-9a-f]{64}$"},
        "quality": {"type": "object"},
        "diagnostics": {"type": "object"}
      }
    }
  }
}
