{
  "schema_version": 1,
  "run_id": "run_1",
  "input_sha256": "aaaaaaaaaaaaaaaaaaaaaaaaaaaaaaaaaaaaaaaaaaaaaaaaaaaaaaaaaaaaaaaa",
  "process": "die_casting",
  "scope_id": "die_casting.golden-product",
  "producer_contract": "measurement_only",
  "measurements": [
    {
      "measurement_id": "measurement_draft_fixed_half_min",
      "operation_id": "draft.fixed_half",
      "calculator_id": "measure_draft",
      "metric_id": "dc.geometry.draft.fixed_half",
      "quantity_id": "draft_angle_deg",
      "value": 1.2,
      "unit": "degree",
      "status": "measured",
      "geometry_refs": [],
      "region_refs": ["region.fixed_half"],
      "field_refs": ["field_draft_fixed_half"],
      "method": "nx_open_draft_analysis",
      "algorithm_version": "nx-draft-1",
      "input_sha256": "aaaaaaaaaaaaaaaaaaaaaaaaaaaaaaaaaaaaaaaaaaaaaaaaaaaaaaaaaaaaaaaa",
      "quality": {},
      "diagnostics": {}
    }
  ]
}
